### ISSUE TITLE
Connective to node IPs

### ISSUE THREAD

**Issue by elgamal2020** [intel/multus-cni#463]
unlike problem "Can not connect to macvlan IP address from node #226" promic mode is set 

In my setup , I have 3 nodes (2master/worker + 1 worker) setup by Kubespray v1.16
Each node has 2 interfaces ens3 and ens4 in promiscuous mode 
ens3: flags=4419<UP,BROADCAST,RUNNING,PROMISC,MULTICAST>  mtu 1500
        inet 10.20.100.19  netmask 255.255.255.0  broadcast 10.20.100.255
        inet6 fe80::f816:3eff:fe66:4b56  prefixlen 64  scopeid 0x20<link>
        ether fa:16:3e:66:4b:56  txqueuelen 1000  (Ethernet)
        RX packets 73401824  bytes 16138294854 (16.1 GB)
        RX errors 0  dropped 0  overruns 0  frame 0
        TX packets 72220573  bytes 14063934060 (14.0 GB)
        TX errors 0  dropped 0 overruns 0  carrier 0  collisions 0

ubuntu@ks1:~$ ifconfig ens4
ens4: flags=4419<UP,BROADCAST,RUNNING,PROMISC,MULTICAST>  mtu 1500
        inet 10.20.10.12  netmask 255.255.255.0  broadcast 10.20.10.255
        inet6 fe80::f816:3eff:fee2:4ede  prefixlen 64  scopeid 0x20<link>
        ether fa:16:3e:e2:4e:de  txqueuelen 1000  (Ethernet)
        RX packets 757  bytes 56404 (56.4 KB)
        RX errors 0  dropped 0  overruns 0  frame 0
        TX packets 813  bytes 57474 (57.4 KB)
        TX errors 0  dropped 0 overruns 0  carrier 0  collisions 0

kubectl get nodes
NAME   STATUS   ROLES    AGE     VERSION
ks1    Ready    master   7d23h   v1.16.6
ks2    Ready    master   7d23h   v1.16.6
ks3    Ready    <none>   7d23h   v1.16.6

I have installed multus and tried the macvlan conf on both VLans

Name:         macvlan-conf
Namespace:    default
Labels:       <none>
Annotations:  <none>
API Version:  k8s.cni.cncf.io/v1
Kind:         NetworkAttachmentDefinition
Metadata:
  Creation Timestamp:  2020-03-23T05:37:04Z
  Generation:          1
  Resource Version:    1221507
  Self Link:           /apis/k8s.cni.cncf.io/v1/namespaces/default/network-attachment-definitions/macvlan-conf
  UID:                 e70b5084-8de7-49bc-a806-d1ce9cfef683
Spec:
  Config:  { "cniVersion": "0.3.0", "type": "macvlan", "master": "ens4", "mode": "bridge", "ipam": { "type": "host-local", "subnet": "10.20.10.0/24", "rangeStart": "10.20.10.200", "rangeEnd": "10.20.10.216", "routes": [ { "dst": "0.0.0.0/0" } ], "gateway": "10.20.10.1" } }
Events:    <none>

Name:         macvlanens3
Namespace:    default
Labels:       <none>
Annotations:  <none>
API Version:  k8s.cni.cncf.io/v1
Kind:         NetworkAttachmentDefinition
Metadata:
  Creation Timestamp:  2020-03-23T05:42:45Z
  Generation:          1
  Resource Version:    1222135
  Self Link:           /apis/k8s.cni.cncf.io/v1/namespaces/default/network-attachment-definitions/macvlanens3
  UID:                 11bab962-92d2-41db-9061-3a3d0a789812
Spec:
  Config:  { "cniVersion": "0.3.0", "type": "macvlan", "master": "ens3", "mode": "bridge", "ipam": { "type": "host-local", "subnet": "10.20.100.0/24", "rangeStart": "10.20.100.200", "rangeEnd": "10.20.100.216", "routes": [ { "dst": "0.0.0.0/0" } ], "gateway": "10.20.100.1" } }
Events:    <none>

I configured my deployment to be connected to both networks 

apiVersion: apps/v1
kind: Deployment
metadata:
  name: samplepod66
  annotations:
    k8s.v1.cni.cncf.io/networks: macvlan-conf,macvlanens3
  labels:
    app: samplepod66
spec:
  replicas: 3
  selector:
    matchLabels:
      app: samplepod66
  template:
    metadata:
      labels:
        app: samplepod66
      annotations:
        k8s.v1.cni.cncf.io/networks: macvlan-conf,macvlanens3
    spec:
      containers:
      - name: samplepod66
        command: ["/bin/bash", "-c", "sleep 2000000000000"]
        image: centos/tools

then I try the conf

samplepod33                         1/1     Running     1          100m   10.233.93.30   ks3      <none>           <none>
samplepod44                         1/1     Running     1          96m    10.233.93.31   ks3      <none>           <none>

For pods in the same node , I can ping additional IP interfaces between each other and it appears on TCP dump of the node interface

ubuntu@ks1:~$ kubectl exec -it samplepod33 ping 10.20.10.212
PING 10.20.10.212 (10.20.10.212) 56(84) bytes of data.
64 bytes from 10.20.10.212: icmp_seq=1 ttl=64 time=0.493 ms
64 bytes from 10.20.10.212: icmp_seq=2 ttl=64 time=0.094 ms

kubectl exec -it samplepod33 ping 10.20.100.207
PING 10.20.100.207 (10.20.100.207) 56(84) bytes of data.
64 bytes from 10.20.100.207: icmp_seq=1 ttl=64 time=0.139 ms
64 bytes from 10.20.100.207: icmp_seq=2 ttl=64 time=0.051 ms
It is also shown on TCPdump of the host interfaces 

sudo tcpdump -i ens4 icmp
tcpdump: verbose output suppressed, use -v or -vv for full protocol decode
listening on ens4, link-type EN10MB (Ethernet), capture size 262144 bytes
07:27:32.465853 IP 10.20.10.211 > 10.20.10.212: ICMP echo request, id 11, seq 1, length 64
07:27:32.465906 IP 10.20.10.212 > 10.20.10.211: ICMP echo reply, id 11, seq 1, length 64
07:27:33.476618 IP 10.20.10.211 > 10.20.10.212: ICMP echo request, id 11, seq 2, length 64
07:27:33.476664 IP 10.20.10.212 > 10.20.10.211: ICMP echo reply, id 11, seq 2, length 64

But never to the host IPs

ubuntu@ks1:~$ kubectl exec -it samplepod33 ping 10.20.100.17
PING 10.20.100.17 (10.20.100.17) 56(84) bytes of data.
From 10.20.100.206 icmp_seq=1 Destination Host Unreachable
From 10.20.100.206 icmp_seq=2 Destination Host Unreachable
From 10.20.100.206 icmp_seq=3 Destination Host Unreachable
^C
--- 10.20.100.17 ping statistics ---
5 packets transmitted, 0 received, +3 errors, 100% packet loss, time 4101ms
pipe 4
command terminated with exit code 1
ubuntu@ks1:~$ kubectl exec -it samplepod33 ping 10.20.10.37
PING 10.20.10.37 (10.20.10.37) 56(84) bytes of data.
From 10.20.10.211 icmp_seq=1 Destination Host Unreachable
From 10.20.10.211 icmp_seq=2 Destination Host Unreachable
From 10.20.10.211 icmp_seq=3 Destination Host Unreachable

Also if pods are on different nodes , it doesn’t work 

ubuntu@ks1:~$ kubectl exec -it sampl ping 10.20.10.205
Error from server (NotFound): pods "sampl" not found
ubuntu@ks1:~$ kubectl exec -it samplepod33 ping 10.20.10.205
PING 10.20.10.205 (10.20.10.205) 56(84) bytes of data.
From 10.20.10.211 icmp_seq=1 Destination Host Unreachable
From 10.20.10.211 icmp_seq=2 Destination Host Unreachable
From 10.20.10.211 icmp_seq=3 Destination Host Unreachable
From 10.20.10.211 icmp_seq=4 Destination Host Unreachable
From 10.20.10.211 icmp_seq=5 Destination Host Unreachable
From 10.20.10.211 icmp_seq=6 Destination Host Unreachable
^C
--- 10.20.10.205 ping statistics ---
7 packets transmitted, 0 received, +6 errors, 100% packet loss, time 6128ms
pipe 4
command terminated with exit code 1
ubuntu@ks1:~$ kubectl exec -it samplepod33 ping 10.20.100.203
PING 10.20.100.203 (10.20.100.203) 56(84) bytes of data.
From 10.20.100.206 icmp_seq=1 Destination Host Unreachable
From 10.20.100.206 icmp_seq=2 Destination Host Unreachable
From 10.20.100.206 icmp_seq=3 Destination Host Unreachable
^C
--- 10.20.100.203 ping statistics ---
4 packets transmitted, 0 received, +3 errors, 100% packet loss, time 3050ms
pipe 4
command terminated with exit code 1

I believe that there is a small missing configuration but I can’t get to it 

Thanks a lot

**Comment by s1061123** [comment]
Due to security consideration, between macvlan and its master interface cannot send/recv traffic.

It is expected behavior of linux kernel networking as following:
please check the section: "Communication with the Docker host over macvlan"

https://docs.docker.com/v17.09/engine/userguide/networking/get-started-macvlan/#macvlan-bridge-mode-example-usage

**Comment by elgamal2020** [comment]
Hello, what exactly blocks the communication with the node ?, I dont see the blocking point 
Promocious mode is enable on both openstack compute and VMs , why it is not working on the overlay between nodes ?

Please re-open the ticket

**Comment by s1061123** [comment]
I mean that linux kernel network blocks the communication. Even though physical NIC driver punted the packet by promiscuous mode, then macvlan driver, invoked after physical NIC driver, filters the packet. This is done by linux network stack.

You can ask linux kernel community for that.

**Comment by elgamal2020** [comment]
I tend to believe so , but I want to know what exactly is blocking 

See here https://github.com/intel/multus-cni/issues/390

they have a working cluster , also why overlay communication is not established ?

BR

**Comment by s1061123** [comment]
>I tend to believe so , but I want to know what exactly is blocking

You can easily test without multus, to create macvlan with `ip netns` command with `ip link` command. Then you can dig into linux network stack.

See following doc to create: https://developers.redhat.com/blog/2018/10/22/introduction-to-linux-interfaces-for-virtual-networking/#macvlan

Welcome to linux networking!

**Comment by elgamal2020** [comment]
Thanks a lot , I will try this out and keep you posted 

Thanks for your help and the warm welcoming :)
